Category,Post Headline/Hook,Statistic or Fact,Source Name
Resilience,Hurricane-Grade Protection,Anchored shipping containers can withstand wind speeds up to 180 mph (Category 5 strength).,USA-Containers LLC
Resilience,Standard Unit Wind Rating,Unsecured 20ft steel ISO containers can resist winds up to 150 mph.,American Trailer Rentals
Resilience,High-Cube Wind Rating,Unsecured 40ft high cube containers are rated for 130 mph winds.,American Trailer Rentals
Resilience,Storm-Proven Durability,Shipping containers are designed to endure waves up to 50 feet in height and extreme ocean storms.,Valtran
Durability,The Power of Corten Steel,Corten steel used in containers is up to 8x more corrosion-resistant than standard carbon steel.,Container Alliance
Durability,Near Eternal Assets,Corten steel structures can last decades to over 100 years with proper maintenance.,A American Container
Durability,Extended Lifespan,A well-maintained container can last 30 years or more; 40ft units often outlive 20ft units as they are rarely packed to their weight limit.,iContainers
Market Authority,A Growing $16B Industry,The global shipping container market is projected to reach $16.49 billion by 2033.,Yahoo Finance
Market Authority,Manufacturing Dominance,Approximately 97% of all shipping containers are manufactured in China.,iContainers
Market Authority,Ownership vs Leasing,About half of the world's shipping containers are leased by shipping lines rather than owned.,Container One
Efficiency,Build 70% Faster,Container buildings can be completed 60-70% faster than traditional construction.,Conexwest
Efficiency,Construction Cost Savings,Shipping container structures typically cost 20-30% less than traditional building methods.,Conexwest
Efficiency,Rapid ROI,While a traditional building might take 6-12 months a container structure can be ready in 6-8 weeks.,Conexwest
Efficiency,Unloading Speed,In North American ports it takes an average of 76 seconds to load or unload a single container.,Discover Containers
Sustainability,Massive Steel Savings,Repurposing a single container saves an estimated 3,500kg of steel.,Conexwest
Sustainability,Carbon Footprint Reduction,Using recycled steel in global production prevented nearly 950 million tonnes of CO2 emissions in 2023.,Green Matters
Sustainability,CO2 Impact,Every tonne of container steel reused instead of scrapped saves 1.5 to 2 tonnes of CO2.,LinkedIn
Sustainability,Eco-Appeal,Reusing steel can reduce its Global Warming Potential by up to 95% compared to producing it from scratch.,Green Matters
Operations,Pro Delivery Tip: 40ft Space,A 40ft container requires approximately 120-125 feet of straight-line clearance for safe delivery.,Western Container Sales
Operations,Pro Delivery Tip: 20ft Space,A 20ft container requires a minimum of 75-80 feet of straight-line clearance for delivery.,UsedConex.com
Operations,Overhead Clearance,Delivery trucks need at least 14 feet of vertical clearance and up to 16 feet during the drop-off tilt.,Western Container Sales
Trust & Safety,Scam Surge Warning,Reported losses from shipping container scams exceeded $84,000 in just the first nine months of 2025.,Consumer Protection WA
Trust & Safety,Industry Fraud Spike,Freight and shipping fraud reports surged by 65% between late 2024 and early 2025.,The Supply Chain Xchange
Myth vs Reality,Myth: Rust means a weak unit,Surface rust is normal on Corten steel; it forms a protective layer that actually stops deep decay.,Eveon Containers
Myth vs Reality,Myth: Design is limited,Fact: Containers are modular and can be combined to create expansive layouts with high ceilings and open plans.,SI Container Builds
Myth vs Reality,Myth: They are toxic,Modern repurposed containers undergo rigorous cleaning; one-trip units have no history of toxic cargo.,XCaliber Container
Myth vs Reality,Myth: Too hot to live in,With proper insulation like spray foam and HVAC systems containers are highly energy-efficient.,goipme.com
Myth vs Reality,Myth: Items get ruined inside,99% of containers are wind and watertight (WWT) and include passive vents to prevent moisture buildup.,A.B. Richards
Myth vs Reality,Myth: No load-bearing limits,Fact: The strength of a container is in its four corner posts; the roof and walls cannot bear high loads alone.,goipme.com
Myth vs Reality,Myth: You can bury them as-is,Containers are designed for vertical corner loads; burying one without reinforcement will cause buckling.,Discover Containers
Myth vs Reality,Myth: Permits aren't needed,Fact: While the IBC includes container-based specifications local permits are almost always required.,sowlv.com
Myth vs Reality,Myth: They are indestructible,Fact: Structural integrity is compromised if large sections of walls are cut without steel reinforcement.,M1 Containers
Myth vs Reality,Myth: They are always cheap,Fact: High-end luxury container homes can cost hundreds of thousands due to custom finishes.,SI Container Builds
Myth vs Reality,Myth: They are only temporary,Fact: With proper foundations and design container buildings can last as long as traditional ones.,M1 Containers
Myth vs Reality,Myth: Floors are toxic,NPSA lab tests show floorboards are safe for habitation and do not off-gas toxic chemicals.,YouTube (The Container Guys)
Myth vs Reality,Myth: All "New" is brand new,In the US "new" containers are actually "One-Trip" units that have carried cargo once from China.,Eveon Containers
Myth vs Reality,Myth: Thousands lost at sea,In reality only 0.00009% of global shipments are lost at sea annually (576 units in 2024).,SYNEX Logistics
